{
  "$schema": "https://json-schema.org/draft/2020-12/schema",
  "$id": "urn:unclaimed-platform:schema:property-type-authority-archival-execution-authorization:1.0.0",
  "title": "PropertyTypeAuthorityArchivalExecutionAuthorization",
  "type": "object",
  "additionalProperties": false,
  "required": [
    "schema_version", "artifact_id", "artifact_version", "status", "prepared_on", "gate",
    "review_base_sha", "proposal_package_sha", "proposal_review_audit", "required_approval_ref",
    "single_use", "reusable", "approval_must_pin_artifact_sha", "approval_evidence_path",
    "authority_url", "exact_host", "method", "requests_max_total", "retries_max", "redirects_allowed",
    "response_body_bytes_max", "required_http_status", "required_content_type", "pdf_magic_required",
    "network_execution_authorized", "workflow_creation_authorized", "archive_path_template", "metadata_path",
    "hash_algorithm", "semantic_extraction_allowed", "post_archive_human_review_required",
    "consumed_prior_approvals_reusable", "downstream_gates_remain_closed",
    "next_gate_after_human_approval", "next_gate_after_successful_archive"
  ],
  "properties": {
    "schema_version": {"const": "1.0.0"},
    "artifact_id": {"const": "ca.sco.segment.500_plus.property_type_authority_archival_execution"},
    "artifact_version": {"const": "1.0.0"},
    "status": {"const": "PENDING_HUMAN_AUTHORIZATION"},
    "prepared_on": {"const": "2026-09-15"},
    "gate": {"const": "HUMAN_PROPERTY_TYPE_AUTHORITY_ARCHIVAL_EXECUTION_AUTHORIZATION_REVIEW"},
    "review_base_sha": {"const": "27e82e1358dd2589e3356b2cd4528915c13b26d9"},
    "proposal_package_sha": {"const": "963c205b662cf56260ca7af14d71c65a6916c30f"},
    "proposal_review_audit": {"const": "docs/archive/M3_CA_SCO_PROPERTY_TYPE_AUTHORITY_PROVENANCE_ACQUISITION_PROPOSAL_REVIEW.md"},
    "required_approval_ref": {"const": "APPROVE_PROPERTY_TYPE_AUTHORITY_ARCHIVAL_EXECUTION_ONE_SHOT"},
    "single_use": {"const": true},
    "reusable": {"const": false},
    "approval_must_pin_artifact_sha": {"const": true},
    "approval_evidence_path": {"const": "sources/evidence/ca_sco_property_type_authority_archival_execution_approval.v1.json"},
    "authority_url": {"const": "https://www.sco.ca.gov/Files-UPD/upd_naupa_II_codes_dormancy_periods.pdf"},
    "exact_host": {"const": "www.sco.ca.gov"},
    "method": {"const": "GET"},
    "requests_max_total": {"const": 1},
    "retries_max": {"const": 0},
    "redirects_allowed": {"const": false},
    "response_body_bytes_max": {"const": 16777216},
    "required_http_status": {"const": 200},
    "required_content_type": {"const": "application/pdf"},
    "pdf_magic_required": {"const": true},
    "network_execution_authorized": {"const": false},
    "workflow_creation_authorized": {"const": false},
    "archive_path_template": {"const": "sources/authority/ca/sco/upd_naupa_ii_codes_dormancy_periods/{sha256}.pdf"},
    "metadata_path": {"const": "sources/evidence/ca_sco_property_type_authority_archive.v1.json"},
    "hash_algorithm": {"const": "SHA-256"},
    "semantic_extraction_allowed": {"const": false},
    "post_archive_human_review_required": {"const": true},
    "consumed_prior_approvals_reusable": {"const": false},
    "downstream_gates_remain_closed": {"const": true},
    "next_gate_after_human_approval": {"const": "ONE_SHOT_PROPERTY_TYPE_AUTHORITY_ARCHIVAL_EXECUTION"},
    "next_gate_after_successful_archive": {"const": "HUMAN_PROPERTY_TYPE_AUTHORITY_ARCHIVE_PROVENANCE_REVIEW"}
  }
}
