{
  "schema_version": "1.0.0",
  "artifact_id": "ca.sco.segment.500_plus.property_type_authority_archival_execution",
  "artifact_version": "1.0.0",
  "status": "PENDING_HUMAN_AUTHORIZATION",
  "prepared_on": "2026-09-15",
  "gate": "HUMAN_PROPERTY_TYPE_AUTHORITY_ARCHIVAL_EXECUTION_AUTHORIZATION_REVIEW",
  "review_base_sha": "27e82e1358dd2589e3356b2cd4528915c13b26d9",
  "proposal_package_sha": "963c205b662cf56260ca7af14d71c65a6916c30f",
  "proposal_review_audit": "docs/archive/M3_CA_SCO_PROPERTY_TYPE_AUTHORITY_PROVENANCE_ACQUISITION_PROPOSAL_REVIEW.md",
  "required_approval_ref": "APPROVE_PROPERTY_TYPE_AUTHORITY_ARCHIVAL_EXECUTION_ONE_SHOT",
  "single_use": true,
  "reusable": false,
  "approval_must_pin_artifact_sha": true,
  "approval_evidence_path": "sources/evidence/ca_sco_property_type_authority_archival_execution_approval.v1.json",
  "authority_url": "https://www.sco.ca.gov/Files-UPD/upd_naupa_II_codes_dormancy_periods.pdf",
  "exact_host": "www.sco.ca.gov",
  "method": "GET",
  "requests_max_total": 1,
  "retries_max": 0,
  "redirects_allowed": false,
  "response_body_bytes_max": 16777216,
  "required_http_status": 200,
  "required_content_type": "application/pdf",
  "pdf_magic_required": true,
  "network_execution_authorized": false,
  "workflow_creation_authorized": false,
  "archive_path_template": "sources/authority/ca/sco/upd_naupa_ii_codes_dormancy_periods/{sha256}.pdf",
  "metadata_path": "sources/evidence/ca_sco_property_type_authority_archive.v1.json",
  "hash_algorithm": "SHA-256",
  "semantic_extraction_allowed": false,
  "post_archive_human_review_required": true,
  "consumed_prior_approvals_reusable": false,
  "downstream_gates_remain_closed": true,
  "next_gate_after_human_approval": "ONE_SHOT_PROPERTY_TYPE_AUTHORITY_ARCHIVAL_EXECUTION",
  "next_gate_after_successful_archive": "HUMAN_PROPERTY_TYPE_AUTHORITY_ARCHIVE_PROVENANCE_REVIEW"
}
